10792.jpg,person and pop artist attend the show
10795.jpg,a supporter waves his crowd as they wait a sweater during the first half of sunday 's football game .
10796.jpg,snowy glass ball on a green grass
10799.jpg,a pair of white and white women 's hands out of the same smiles
10800.jpg,a model walks the runway at the fashion show during event .
10804.jpg,a new year to person that you see freedom .
10806.jpg,a snarling mexican grey wolf calls to a new year to walk into the camera .
10807.jpg,condos located in the heart
10809.jpg,person and actor attend the 50th issue celebration performance .
10812.jpg,a sunny day on the beach
10815.jpg,the courtyard of the complex
10816.jpg,the walls of a house
10819.jpg,pumping water from a stream farm
10821.jpg,living room decorated with a queen size tv
10823.jpg,whiskey and champagne on the balcony
10824.jpg,person special a spirited photo by person
10825.jpg,quiet day on the beach
10826.jpg,a city is a world and time to create a new high - town
10827.jpg,a farmer tilling soil on his farm
10829.jpg,baseball player looks on during a cap
10830.jpg,actor attends the premiere during festival
10831.jpg,blues artist live on stage during a concert .
10833.jpg,a lone tree with water on giant wild first high winds
10834.jpg,vector illustration of different people on a black background .
10838.jpg,a cute little monochrome snow by snow .
10839.jpg,person is a male child who has fun a pop dance on the show .
10841.jpg,moon reflecting by the window
10846.jpg,person is a person who he is to her son and her son .
10853.jpg,actor attends the premiere of comedy .
10854.jpg,hairstyles designer wears a portrait of colorful glass isolated on white background
10855.jpg,a man passes a fire through the rain forest .
10857.jpg,actor during an interview with comedian
10859.jpg,young attractive man drinking coffee and looking sadly by the window
10864.jpg,a monitor lizard close up shot .
10866.jpg,a city with a retro retro clothes silhouette crossing a wall
10867.jpg,overboard funny faces at the camera
10868.jpg,a white giraffe spotted in the bush
10870.jpg,person attends the premiere of season
10872.jpg,train station on the highway
10873.jpg,football player stretches for the ball during a training session .
10874.jpg,flag on a white background
10879.jpg,a view of the road from the road
10880.jpg,active lifestyle : the couple looked out of the water on a stone beach
10881.jpg,graffiti wall of the store
10886.jpg,a boy jumping on a tree
10887.jpg,a model walks the runway at the fashion show during fashion week .
10888.jpg,a climber passes a sand field of water
10889.jpg,i want not all boots ... i take this skirt on this print !
10890.jpg,fireplace with a princess and white door
10892.jpg,a boy gets a fish with his baby
10893.jpg,a model walks the runway at the fashion show during fashion week .
10895.jpg,a young male doctor prepares a speech with his baby .
10896.jpg,country road trip in the wilderness
10899.jpg,the sea surges hit shore .
10900.jpg,a man is standing around of a child 's head in the city
10901.jpg,butterfly bears in the basket
10903.jpg,football player celebrates scoring the opening goal during the match .
10904.jpg,vector illustration of a monster
10905.jpg,bedroom with balcony and bathroom .
10908.jpg,a woman looks at her phone
10911.jpg,palm trees in the beach
10912.jpg,person competes in the boys long jump competition
10914.jpg,golfer hits his ball during a training session
10919.jpg,police are seen loading bags of evidence to a home block that they remain the block these days .
10928.jpg,brunch buffet at the restaurant
10931.jpg,a model walks the runway at the fashion show during event .
10932.jpg,actor arrives at the premiere
10935.jpg,a white giraffe spotted in the bush
10936.jpg,a boy is climbing in the grass .
10937.jpg,young woman with a red cup
10938.jpg,the illustration of military commander
10940.jpg,the former home of politician
10941.jpg,hot air balloon floating in the pure blue sky
10942.jpg,aerial view of people during the autumn
10943.jpg,a city which become part of the largest rooms .
10948.jpg,a table with a table from the kitchen .
10949.jpg,coffee cup of coffee with a drink
10950.jpg,actor attends the premiere during festival .
10953.jpg,person and professor share their first dance at the park
10954.jpg,vector illustration of a banner for holiday .
10955.jpg,a man looks at a photograph
10956.jpg,button - up t - shirt from the shining
10957.jpg,a model walks the runway at the fashion show during event .
10959.jpg,a vector illustration of medieval art - ever from : vector art illustration
10960.jpg,actor attends the premiere during festival .
10964.jpg,the tattoo idea of the patterns of knitting !
10966.jpg,person drives the ball down the court during the game against american football team .
10970.jpg,actor is seen on the streets .
10971.jpg,latin pop artist performs on stage during event
10972.jpg,a selection of old black - backed by floor and antique exterior
10973.jpg,a city is part of the most famous tourist attraction .
10974.jpg,digital art selected for the #
10977.jpg,fresh mushrooms on a background of the bottles
10978.jpg,football player looks on during a training session ahead .
10982.jpg,actor is all the second draw for the bride .
10983.jpg,outdoors in style : what 's a cool soldier with a casual look at the age room including these time look like .
10985.jpg,the power of the girl
10988.jpg,pedestrians walking down the street .
10989.jpg,the balcony of house
10991.jpg,# celebrates after being a triple - handed goal .
10993.jpg,seagulls fly over the coast
10994.jpg,upset girl with a red dress talking on the sofa
10998.jpg,young women doing yoga on the sofa
11000.jpg,young woman with tablet pc sitting on the floor with a thick tape
11001.jpg,a horse is moving through a man
11004.jpg,actor attends the premiere during festival .
11006.jpg,roll food topped with ham and a blender
11007.jpg,person
11008.jpg,a canal boat passes houseboats on the canal
11013.jpg,young couple holding hands beneath the road
11014.jpg,a cute puppy is growing out of a bowl
11015.jpg,the popular tree of the beach .
11016.jpg,a city of old young woman near the window
11017.jpg,file photo of a mother with hat stands on a mountain
11018.jpg,hair often the same color of this photo
11021.jpg,a customer views a logo by person
11022.jpg,rugby match of national rules team takes the week .
11023.jpg,pool area for the hotel
11024.jpg,biological species perched on a tree stump
11025.jpg,actor attends the premiere during festival
11029.jpg,a young boy is standing via a cellphone in a restaurant
11032.jpg,a knot from the old glass .
11035.jpg,a passenger passing aside of floats .
11036.jpg,woman walking on the beach at sunset
11040.jpg,the internal church of person
11041.jpg,socialite went majorly grungy in a city .
11043.jpg,houses on the beach
11045.jpg,a view of hills from hills .
11053.jpg,cow sits on a grass
11055.jpg,football player dives over the line ahead of rugby player during the match .
11058.jpg,tortoises are herbivorous animals in the trees
11060.jpg,stripped update of the 1st project
11061.jpg,a combined snow turbine blocks from the line .
11062.jpg,a man is wrapped under a tree trunk
11066.jpg,dead trees stump down the ground
11069.jpg,a young woman walks through a beech tree
11070.jpg,chipmunk on a white background
11073.jpg,a city where cities but only give a long table of the wall .
11078.jpg,young man using tablet computer on the computer train
11079.jpg,bride and groom pose in a wedding dress .
11080.jpg,the stunning blue cave tries out
11081.jpg,conceptual grunge rubber stamp for the state
11084.jpg,young women doing yoga in the summer
11087.jpg,coffee basket with maple on a table
11089.jpg,statue of person at the confluence of the rivers
11091.jpg,police officers talking in gas masks near a village
11093.jpg,flag waving in the wind
11094.jpg,the courtyard of a house
11095.jpg,outdoors in the garden today
11097.jpg,once the use of this pink - photo #
11098.jpg,a man walks along a rural road
11099.jpg,lead singer of heavy metal artist performs on stage
11103.jpg,animal in the basket thanksgiving basket
11105.jpg,food - cake cookies with chocolate chip cookies
11106.jpg,a sign advertises outside a bar
11107.jpg,a glass of ice ice on a white background
11111.jpg,abstract motion of a gold photo
11113.jpg,a soldier hits a protestor for a parade
11114.jpg,young woman with a red coat holds her head around her baby
11117.jpg,a woman looks out to a tree in the autumn sun
11118.jpg,rolling wheel of a car
11119.jpg,a line between an athlete who fell her just show i 'm like .
11121.jpg,heading up of the upper of a house
11124.jpg,a shiny sports car stolen from the driving line outdoors
11125.jpg,illustration of a cute bear
11126.jpg,fruit and fruits stall in the city centre
11127.jpg,a young girl shows a dance in the city
11129.jpg,person performs during the short of a hard program friday .
11130.jpg,a cute puppy makes a dog .
11131.jpg,a young woman is climbing his way to the horizon
11132.jpg,grandmother and children are smiling at each other .
11134.jpg,actor attends the 70th anniversary event during festival at festivals .
11136.jpg,iced coffee in take away cup on a table
11138.jpg,teenage girl with a teenage boy looking at camera with covering
11139.jpg,the city showing the venue
11140.jpg,person and her fans being seen boating .
11141.jpg,students wave a road trip to tourists
11142.jpg,4k photo of the trees with a variety of water .
11143.jpg,a close up portrait of a beautiful lion
11145.jpg,a model walks the runway at the fashion show during event .
11146.jpg,a lone houseboat beside a rock
11148.jpg,a sign advertises the amenities
11149.jpg,actor attends the premiere of comedy .
11150.jpg,actor attends the premiere during festival at person .
11152.jpg,person is a male child who is to her son 's arm .
11153.jpg,sunset over the estuary on the beach
11154.jpg,a lone houseboat beside a table on the river
11157.jpg,young woman jogging on grass during the sunset in slow motion
11158.jpg,a man is wrapped up to her car on a busy street
11159.jpg,a cute little monochrome cake for understated romance
11160.jpg,mosaic with a pattern of ice .
11162.jpg,funny cats sitting on rocks smiling to the window
11164.jpg,soldier and person attend the premiere
11165.jpg,the converted church on a new residential building on the campus
11166.jpg,little girl crying on the grass
11167.jpg,a young male grizzly standing in a winter wonderland
11170.jpg,person warms up during the match .
11171.jpg,a trip for covering of the bride 's diamond
11175.jpg,sometimes this is a yellow blazer that is not a fan or sets to see the color .
11176.jpg,a woman looks out to her hair
11177.jpg,person and actor on the beach
11179.jpg,women are seen in the water
11180.jpg,person
11183.jpg,a digital illustration of a priest by person
11185.jpg,bag of a biker bag
11187.jpg,person attends the premiere of season .
11189.jpg,players huddle in the early zone .
11190.jpg,a city : the world was one of the most important object of penguin pieces .
11191.jpg,snowfall in the forest top winter
11192.jpg,a young woman is agitated in a window standing in a window
11193.jpg,a cart leaves on a rural meadow
11194.jpg,tortoise and white - tailed doves on the rocks
11195.jpg,a male beautiful surfer running on the beach
11197.jpg,cattle pictured on a farm
11198.jpg,wooden paneling of the old tiles
11199.jpg,salted caramel on a green ceramic background
11201.jpg,the annual city at night
11202.jpg,the water was listed by architect .
11205.jpg,noble person was a perfect emerald and white women are arrive to throw down .
11207.jpg,watering could be great as a cake
11209.jpg,mirrors are rolling on the balcony
11210.jpg,i all all them pay them pay them them them them them them them them them are born
11212.jpg,pretty girl with a white dress sitting on a white background
11213.jpg,sphere reflected of a male face holding balloons and balloons in the air
11214.jpg,powerpoint template displaying a new fashion by person
11215.jpg,the same frost in the old city
11218.jpg,actor attends the premiere of romantic comedy film .
11220.jpg,a cute girl is sitting on a couch with badges
11221.jpg,senior male sitting on a bench and looking to a glass
11222.jpg,oxen eating dry hay in the woods
11224.jpg,person and hip hop artist attend the party
11225.jpg,the home where the home where journalist
11226.jpg,families relax on their kids during their home during the beautiful day
11227.jpg,a young woman is agitated the grass
11228.jpg,a man walks along a sand road
11229.jpg,a fruit is seen in the morning sun
11230.jpg,glass shiny abstract red and white - elements photo .
11231.jpg,a young sister is agitated a girl where a gift shop
11234.jpg,famous series of the year
11235.jpg,flower vase on a tree
11236.jpg,kitten facing on a large tree
11238.jpg,person wears a dress at the celebration of the women 's march .
11241.jpg,actor needed a helping new that he is a chance for experience time .
11242.jpg,musical instrument company vs musical instrument company --
11243.jpg,young woman talking on smartphone in the city
11244.jpg,a local man locks his fishing rod at sunset .
11245.jpg,construction site in the area
11247.jpg,a horse in the grass
11248.jpg,guitarist and bassist of person perform
11250.jpg,4k aerial of the stars during the rain
11252.jpg,portion image of people sitting on the main courtyard of the building
11253.jpg,a girl in a pink dress and a fashion retro clothes
11255.jpg,golfer competes in the second round .
11257.jpg,a city is one of the - - - style hotel
11258.jpg,sheep walking along the plains
11259.jpg,portrait of a baby boy
11262.jpg,a large number silhouette of a young male elk
11263.jpg,flag colored toys on a shelf
11264.jpg,logo on the website homepage
11265.jpg,vector illustration of modern icons on a light background
11266.jpg,a winter sunrise over the glacier
11267.jpg,a lady lifts a low arm of a child who is a newborn girl with a spoon
11269.jpg,a sign advertises outside a newly wholesale warehouse with police force .
11270.jpg,a birthday cake with a gift new experience cards .
11273.jpg,football player celebrates with athlete after scoring the opening goal of the game
11274.jpg,the sun sets over the desert
11276.jpg,illustration of a christmas fairy fairy illustration
11278.jpg,a family sitting on a stone house
11279.jpg,reflection of coconut trees in the forest
11281.jpg,drawing of a person and painting artist
11284.jpg,the former home of politician
11286.jpg,4k strong portrait of happy mother and family children playing in the park
11287.jpg,biological species
11288.jpg,a boy walks down a sand field in the middle of a city
11289.jpg,a city on the municipalities map
11290.jpg,illustration representing wanderlust : a young couple made a new new new year to the new evening .
11292.jpg,young couple sitting on the beach
11294.jpg,a woman looks at her phone while wearing glasses
11296.jpg,a street sign was being a hour through a city
11297.jpg,a view of a wall - off ship
11298.jpg,camel walking along the plains
11299.jpg,a woman looks out to her hair trying with his pet
11300.jpg,a city is part of the largest largest public silver and beams
11301.jpg,finished pumpkin : a magic pattern by film character .
11302.jpg,a city and one of the old town
11303.jpg,a house with solar panels
11304.jpg,leather bag on a white background .
11305.jpg,heavy traffic on south
11306.jpg,milk glass with a drink .
11309.jpg,the castle bathed in sunshine
11310.jpg,fireworks over river showing the sun
11311.jpg,person and professor are problem for a photo during her husband as a group of dancing a meal
11312.jpg,a boy in a long black gift with a long sign on his head
11313.jpg,actor posed during the portrait session .
11314.jpg,outdoor harbor for the summer
11315.jpg,a person growing some wearing glasses with a long white t vector art illustration
11319.jpg,actor attends the premiere during festival at person .
11320.jpg,person celebrates his goal during the match .
11321.jpg,biological species sits on the grass
