10001.jpg,a picture of the bronze shoes from running shoes
10003.jpg,fans clash their team in the stands .
10004.jpg,vector illustration of a bear for holiday .
10009.jpg,vector abstract christmas sphere pattern with a cute background .
10010.jpg,a view of the road from the beach
10011.jpg,pop artist performs on stage during the tour .
10012.jpg,actor attends the premiere during festival
10013.jpg,political map with the several regions where spanish autonomous community is highlighted
10014.jpg,amazing running down the boat
10019.jpg,illustration of a monkey inside a pot
10020.jpg,% image of a traditional group of ethnicity leading planting fountain
10022.jpg,actor arrives at the premiere
10024.jpg,soak cork of walnuts on a cutting surface
10025.jpg,a black puppy puppy walking down a board in the morning casts a pair of water .
10026.jpg,actor is seen on the streets .
10027.jpg,abstract graphic eye of a futuristic globe with a gold globe
10028.jpg,a dog 's head isolated on white
10029.jpg,raw oatmeal and a food
10030.jpg,a teenage future not good to music members .
10035.jpg,game of the white pieces vector illustration
10039.jpg,gondola on the water
10040.jpg,various plastic plates and cutlery in a bowl
10042.jpg,person of person performs during a concert
10044.jpg,a row of trees in the autumn sun
10045.jpg,favorite pins on a table
10046.jpg,flag waving in the wind
10047.jpg,theatre actor and actor attend the premiere
10048.jpg,a boy is wearing a broken back to run in the woods
10049.jpg,pop artist performs during festival .
10050.jpg,i 'm pretty going all these girls colors like this !
10052.jpg,person and groom sharing their first dance at the wedding reception .
10053.jpg,quiet day : the two of the day hits us state
10054.jpg,baseball player of the fields during a game against sports team
10055.jpg,baby girl dressed as a dog
10056.jpg,a boy rides through a megaphone
10060.jpg,actor attends the premiere at .
10061.jpg,a man is wrapped up on a red grass
10064.jpg,a wall wall construction under construction
10066.jpg,a farmer rolling oats to a home .
10069.jpg,tall ship sails in the harbor
10070.jpg,young couple sharing a book in old park
10071.jpg,person is a difficult than dating that he visited me must perk it .
10072.jpg,voice : members of the community demonstrate outside the event .
10074.jpg,rhythm and blues artist appears onstage during music video tv program .
10075.jpg,a drawing of astronomers observing a question of the human
10076.jpg,person wears a coat and clothes
10078.jpg,the story of the painting
10079.jpg,residents take a boat on the bank .
10083.jpg,bride and groom pose in a luxurious wedding dress .
10085.jpg,person prepares to compete for the right - winning college .
10086.jpg,a wind farm just towards the shore
10087.jpg,astronaut and race celebrate western christian holiday
10088.jpg,western christian holiday presents with a drink and a cute expression .
10091.jpg,portrait of a teenage girl sitting at a table and standing with her daughter
10093.jpg,the lily pond in the city
10096.jpg,a young lady is brushing her teeth under her dog
10097.jpg,logo on the website homepage
10098.jpg,nurse 's uniform cake with a plastic bag and touching
10099.jpg,a boy is wrapped his next next to the swimming pool
10103.jpg,graceful woman practicing positions with her son wrapped a large camera on her head
10104.jpg,actor and teacher at the premiere of romantic comedy film .
10105.jpg,compare can be found by the sky
10106.jpg,artist of the band performs live on stage during the tour opener .
10109.jpg,aerial photograph of the archipelago
10111.jpg,person former award gets being carried during the first half of saturday football game .
10113.jpg,smooth metallic gray uppercase or capital letter f in a 3d illustration with a shiny silver smooth surface finish and classic style font isolated on a white background with clipping path .
10115.jpg,a chef cooking a healthy - not all food !
10117.jpg,a customer views of a woman counting a camera
10119.jpg,vector illustration of modern icons for different and different food
10120.jpg,a juvenile dog is running through a field of water .
10121.jpg,a street on the street !
10122.jpg,a child playing a pipe organ to the office
10123.jpg,a large number of beautiful horses
10124.jpg,a man sits in the middle of a city
10125.jpg,burning trees in the sky
10126.jpg,person performs live on stage during a concert
10127.jpg,a man shields himself standing in the rain
10128.jpg,actor attends the premiere held .
10129.jpg,posters for the summer summer never made up the days .
10130.jpg,construction site on the western side of the construction
10131.jpg,shop
10132.jpg,a close up image of assorted of a fork found on a white background
10135.jpg,football player celebrates scoring his side 's second goal during the match .
10136.jpg,a colorful pair of cricket player speaking during the first day
10137.jpg,a city with one of the most futuristic buildings in the world
10138.jpg,a christmas tree made by person
10140.jpg,the current generation of people
10141.jpg,a sleek band of necklace
10142.jpg,a boy is seen attending a house next to the girls 's test
10143.jpg,fireworks over river during celebrations
10144.jpg,a boy is standing around a megaphone
10146.jpg,a triple - evening wedding dress sitting on the couch
10147.jpg,a sign advertises miniature sign for her latest
10148.jpg,bedroom with tall plantation shutters in the living area
10149.jpg,a meal is seen on the shelf
10150.jpg,men riding horses on a bicycle in a traditional town
10152.jpg,a lot of my family being a dog walk on a trail
10153.jpg,a worker on construction site
10155.jpg,aerial view of the old town
10161.jpg,energy efficient windows found kept or inspiring design
10163.jpg,would be perfect for a floral but looks .
10165.jpg,vector illustration of a banner for holiday .
10167.jpg,actor attends the opening ceremony of comedy film .
10173.jpg,a man looks through a man 's making
10174.jpg,contemporary christian holiday with the newspapers and person
10175.jpg,a young boy is climbing a carousel
10180.jpg,person attends the premiere of season
10182.jpg,mechanic removes a car from a car .
10184.jpg,a cute puppy is sitting around a sink on a table
10185.jpg,a guest is seen on the street wearing a green dress during her menswear week
10187.jpg,actor attends the uk premiere
10188.jpg,basketball player drives a basketball ball to person during the basketball tournament .
10189.jpg,frost falling on a tree
10190.jpg,sparrow crows on a green lawn
10191.jpg,a horse and his horse warm up of a bowl of water
10193.jpg,singer of the band performs live on stage during the tour opener .
10195.jpg,person
10196.jpg,the dance team performs during the match .
10198.jpg,original cover - flag decorating illustration
10199.jpg,fans in the banner for performance .
10200.jpg,a loving woman is walking on the beach at the beach
10201.jpg,a model walks the runway at the show during fashion week
10204.jpg,a delivery truck is seen on the busy street
10205.jpg,a hot fly over the water
10208.jpg,the current family room at midday .
10209.jpg,black and white illustration of a house with balloons on white background
10210.jpg,a person looks at a time fireplace
10212.jpg,3d rendering ball decorated with the flag
10213.jpg,sunset over river in the background
10214.jpg,dreadlocks - hair star : person kept her hair as she worked to return the most way to the gas
10215.jpg,fans sing during the match .
10216.jpg,person performs onstage during music festival .
10217.jpg,illustration of a signboard posted with a horse
10218.jpg,fresh asparagus on a background of the water
10220.jpg,file photo dated holds a photo of a box
10221.jpg,the parking garage for their pick - up auditorium
10222.jpg,a city with a bird
10223.jpg,children reading books on the park
10225.jpg,actor attends the press conference of automotive industry business
10226.jpg,person and actor attend the 50th issue celebration
10227.jpg,actor attends the premiere during festival .
10229.jpg,a child is pictured on his back to the beach
10231.jpg,a man wearing a black coat standing on a skateboard
10232.jpg,a slow zoom shot of a young girl kayaking his bicycle on trails at sunrise time
10240.jpg,a person looks at a sewing machine
10241.jpg,a man who is seen to stay after a walk walk in the woods
10242.jpg,a city in the world
10243.jpg,a cute dog sleeping in tall hands outside a sink
10246.jpg,aerial flying over the sea
10248.jpg,complete dash of the many goats we met into the fountain
10250.jpg,a lot of hot floors
10253.jpg,the 1st residential home
10254.jpg,trousers trousers with a leather jacket and purple t vector trousers
10255.jpg,every morning are a few of fun movies !
10260.jpg,actor attends the season premiere .
10261.jpg,a family sitting on a mobile phone
10262.jpg,person and professor are seen in all time .
10265.jpg,senior couple sitting on the beach
10266.jpg,various spices on the wooden background
10267.jpg,10 of the best bedroom
10268.jpg,intricate details of the medieval architecture
10269.jpg,food with food at a market
10270.jpg,a child playing with her baby
10271.jpg,digital art selected for the #
10273.jpg,nurse makes a patient to a pair of white and white fur
10274.jpg,actor attends the premiere during festival
10275.jpg,a parking is seen in a moment way
10276.jpg,a swing swing on a house
10278.jpg,the current owners have planned have been all the spa
10279.jpg,person is photographed for a press client
10281.jpg,a cute puppy is sitting on a couch
10287.jpg,a flower loses its petals in the later summer heat .
10288.jpg,rugby player looks on during a training session ahead .
10294.jpg,pretty young woman uses a phone at home
10295.jpg,a city in the past
10297.jpg,gallery celebrating holiday with the tea and person
10298.jpg,a lot baby girl with a bottle of water
10301.jpg,portrait of a man holding flag and smiling
10302.jpg,a construction worker bends on a green grass
10305.jpg,balloons gather in the area
10308.jpg,drawing of a rice and reading space
10309.jpg,view of foam on the big mountain
10310.jpg,squirrel carries seeds in the meadow
10311.jpg,lioness and her first draw on the beach
10312.jpg,profession cuts a laptop with a watering slow motion
10313.jpg,a hiker walks along the lower of a sea .
10315.jpg,actor attends the premiere during festival .
10317.jpg,a market stall is seen of the dome
10318.jpg,museum showing a shopping mall
10320.jpg,mountain range of the mountains
10323.jpg,a black - toed eagle soaring on a large mill
10325.jpg,a bus passes aside to become a patch of wood .
10326.jpg,a general view of stadium
10328.jpg,vector illustration of shark in the snow .
10331.jpg,a cute puppy is sitting on the couch with her daughter
10332.jpg,pages of a coffee and reading box featuring
10334.jpg,a bee collects pollen over a field of flowers .
10335.jpg,broken of the stars this takes to fly the surface
10336.jpg,actor attends the season premiere
10339.jpg,images vs. girls basketball game .
10340.jpg,bedroom with a queen size bed
10345.jpg,living room decorated with a vessel sink
10346.jpg,floor plan of the revamped
10350.jpg,a bird on wooden wall
10351.jpg,a woman in a red oak oak
10354.jpg,the yacht at the 59th st coast
10355.jpg,womans - this is a person for your new year every sunday !
10356.jpg,beware steep cliffs warning sign on the coastal footpath national trail
10358.jpg,person takes a break - up - on the photo sharing .
10359.jpg,ravishing girl taking a phone number in the mountains
10360.jpg,young attractive woman meditating on the beach
10361.jpg,actor wears a coat and skirt on her cheek
10362.jpg,close up of a girl 's very happy girl with a butterfly flower
10363.jpg,fans wait their gymnast during the first quarter .
10364.jpg,rooftops of cottages in the countryside laden
10366.jpg,property image # fisherman house feet in the water
10367.jpg,illustration of a caveman vector art illustration
10370.jpg,senior couple couple in the city
10371.jpg,biological species
10372.jpg,boat on a lake with hills on the lake
10374.jpg,players celebrate after the match .
10376.jpg,a palm tree with fallen behind the house
10379.jpg,a very beautiful leotard blue grass frog with traces inlay
10381.jpg,aerial view of beautiful grass on the shore under field at sunset
10382.jpg,deities is a man in the middle of the world
10385.jpg,a few years ago pictures of a guide dog
10387.jpg,a group of young friends are walk over market in the public
10389.jpg,football player became piqued the only manager to take uk constituent country into the finals during the second minute .
10391.jpg,a white horse elk standing in the woods gets a fence
10393.jpg,a model walks the runway at the fashion show during event .
10394.jpg,my hair color for this !
10397.jpg,a woman looks at a computer
10400.jpg,actor attends the premiere during festival at person .
10401.jpg,a dressing of old antique books - by person
10405.jpg,a lonely iceberg hit the shore
10407.jpg,garment these dresses for a hat
10408.jpg,a bouquet of multicolored roses in the sun
10409.jpg,golfer competes his shot during the media launch .
10410.jpg,young mother plays on the beach
10412.jpg,a flight of fancy young girl lying on the couch
10413.jpg,bright design of a house
10414.jpg,a cute puppy is running through a sink
10417.jpg,ready to fight : soldiers deployed attend a military parade during us federal holiday
10418.jpg,jets of water fall on a bush of blossoming lilacs .
10419.jpg,portrait of a bride blushing
10423.jpg,vector illustration of a beautiful clef old woman with a retro formal .
10426.jpg,golden eggs bee -- stock photo #
10427.jpg,actor and his family were spotted boating
10428.jpg,a city : the country was cut into the fountain
10429.jpg,a soldier looks up to a man 's hand during a match .
10430.jpg,a child and child hold their son to their baby girl
10431.jpg,a monitor lizard close up shot of a pair of water
10433.jpg,a vector illustration of a map with a human bank with a wavy paper background
10434.jpg,feb map depicting the location of the major 's major
10435.jpg,a man looks at an apartment building .
10436.jpg,aerial view of houses with a city and a city
10438.jpg,illustration of a boy reading a story on a tree
10440.jpg,a lone plant peaking down a rock
10442.jpg,nice day : the couple reportedly a kiss and her yellow sea in the foreground
10443.jpg,a close up of a bright red gift with a orange bow .
10444.jpg,a flight destined for canadian census division
10445.jpg,fans sing during the match .
10446.jpg,channels art selected for the #
10447.jpg,competitors images of a football team
10449.jpg,cruise ship on the beach
10450.jpg,illustration of a pattern of different cards with hand drawn symbols on display and christmas trees .
10451.jpg,change of the buildings in the world
10452.jpg,actor attends the premiere held
10453.jpg,actors attend the premiere held
10454.jpg,the group of hard rock artist .
10456.jpg,dramatic and jagged rock formation by the coast
10457.jpg,cosmos flowers swaying in the wind
10458.jpg,tourists gather at the festival
10459.jpg,hip hop artists perform onstage during music festival .
10460.jpg,town sign on a black background
10461.jpg,baseball player looks on during the match .
10463.jpg,person is a true of person .
10464.jpg,biological kingdom of the world 's public
10466.jpg,a man walks on a tree in the woods under a tree
10467.jpg,monument at the end of the new solar
10468.jpg,? i like this beautiful girl !
10469.jpg,underwater soft water in the baseball pool .
10471.jpg,moving the master bedroom is a great problem to create a wall door .
10473.jpg,the preparations before the match .
10474.jpg,flag with wind and flag waving in the wind .
10475.jpg,bride and groom pose in the water .
10478.jpg,a cute little monochrome animal with beautiful eyes and white ribbon
10479.jpg,halloween painted make - painted ideas for the editorial
10482.jpg,the spacious main bedroom is a king - filled sitting into a green - backed sunset
10483.jpg,a general view during the match .
10485.jpg,immersing the majesty of person
10487.jpg,a delivery truck without a walk
10488.jpg,actor attends the premiere during festival .
10489.jpg,typical house with a garden
10491.jpg,the factory where machines were maintained left
10492.jpg,birds feeder in a bowl
10496.jpg,a model walks the runway at the fashion show during event .
10497.jpg,muslim artists and folk rock artist
10498.jpg,deity sails in the distance
10499.jpg,actor and peace activist attends the premiere .
10502.jpg,woman in a red dress walking on a white background
10503.jpg,a model walks the runway at the fashion show during fashion week .
10504.jpg,a pair of shoes hanging on a white background
10505.jpg,vector illustration of a baseball drawn
10507.jpg,hot air balloon floating in the desert
10508.jpg,light spectacle in the night sun
10511.jpg,actor attends the premiere of film .
10512.jpg,bee gathering nectar in the garden
10513.jpg,a city showing her last new year .
10517.jpg,a future for introducing design with oversized
10518.jpg,a gallery of noble person
10522.jpg,a general view during the national football match .
10526.jpg,a vector illustration of a mascot
10528.jpg,aerial view of the many walks tourist attraction known hit above the beautiful cloud rough by the city
10529.jpg,fans set of flares during the ceremony .
10530.jpg,person is a picture of a person by person .
10533.jpg,a christmas tree with gifts bow
10534.jpg,young woman with tablet pc sitting on the couch at the restaurant
10536.jpg,actor attends the sword of her new home .
10537.jpg,never been fun to have a tattoo
10538.jpg,bride walking on the beach
10541.jpg,person kicks a ball into stoppage during the match .
10542.jpg,1 of balconies in the house
10543.jpg,a row of traditional black coloured no lit on display
10544.jpg,golfer looks on during a walk in the mountains
10545.jpg,actor attends the premiere during festival .
10546.jpg,a large tree holds up of the tree .
10547.jpg,football coach speaks with players during the match .
10549.jpg,trust : the manual console in the world
10552.jpg,a protester salutes a protester as part .
10553.jpg,vector illustration of a stamp for jewish holiday .
10554.jpg,a city view of stadium
10558.jpg,illustration of a long shadow female head with a thief
10560.jpg,a sleepy shaggy lion decided to change the place in march .
10562.jpg,person and staff delivering eggs during the training session .
10564.jpg,evening view of the car
10565.jpg,a beautiful view of the forest
10569.jpg,thumb drawn dimension of a circular coil
10570.jpg,drops the pc clockwise down the right .
10571.jpg,person attends fashion designer show during fashion week .
10575.jpg,a cute puppy sleeping with a twine on her kitchen .
10576.jpg,pastor members award in the meeting room .
10577.jpg,a chef holding food for fresh water
10578.jpg,a young woman standing on a rock standing behind a rock into the shadows
10580.jpg,silhouette of young man doing a school in the mountains
10582.jpg,taipei visually reminded me given .
10586.jpg,crowds of protesters gather during a protest against politician
10588.jpg,a young girl rides a tied down inflatable bottle of water from a farm shop
10590.jpg,aerial view of the town
10591.jpg,a street sign was built .
10592.jpg,a city is one of the most canals by the most sacred .
10593.jpg,flag waving in the wind
10594.jpg,person is a male girl who has fun for her son .
10595.jpg,man and woman walking outdoors on a beach
10596.jpg,a classic design returns for sale
10598.jpg,time lapse of the stars moving across the night sky
10599.jpg,ice hockey coach has a popular player for his team - mates - mates player during the paris minute
10600.jpg,a beautiful sunset over bodies of water
10601.jpg,tourists stand guard outside a hut
10602.jpg,why to get a playhouse in your home ?
10607.jpg,girlfriends looking at the table
10608.jpg,tattoo ideas for women and tattoo artists are a pet
10610.jpg,a vector illustration of triangle on a white backgrounds and hearts .
10611.jpg,a city is a world transport by organisation founder and a large shovel of the vehicle
10613.jpg,a city where one of the walkways
10614.jpg,a lone tree with fallen snow move in the dunes
10615.jpg,farewell message - this article is bale for those should make a man squirrel
10616.jpg,10 of the many futuristic buildings with land and cities live
10619.jpg,disused cranes in the harbor
10620.jpg,the home was completed
10621.jpg,a collection of miniature teapots
10623.jpg,tourists enjoying a city in the area
10625.jpg,images of a passports on money
10626.jpg,portrait of a girl with abacus
10628.jpg,a snowy park with tall trees
10630.jpg,chef walks the runway at the winter fashion show during fashion week .
10631.jpg,football union team celebrate the 2 of the match
10633.jpg,stones on the beach at sunset
10634.jpg,fans cheer in the stands before the game against american football team .
10635.jpg,men dry up along a board
10639.jpg,the sleepy era of person
10642.jpg,girl in a purple dress and women 's love
10645.jpg,a pan of beef stew .
10648.jpg,a set of black lines on a white background
10649.jpg,# shoots against sports team during their game .
10654.jpg,a protester juggling his death on sunday
10655.jpg,a thatched cottage with old tiles
10656.jpg,profession checks a phone on ice during the spring months
10657.jpg,a driver texting for traffic
10658.jpg,traditional wine shop rise in the font
10659.jpg,illustration of a young boy standing on a white background
10660.jpg,person reacts during the match .
10661.jpg,a closer look at the tesla model spd ludicrous
10663.jpg,person and actor attend the press night performance
10665.jpg,football player poses during the match .
10667.jpg,a ray walks along the shore
10668.jpg,a young lady is agitated a baby girl in the village
10671.jpg,a mechanic reviews a car past through the street .
10674.jpg,person and actor attend the premiere .
10675.jpg,fans sing on the year
10676.jpg,fans scale of flares from the final
10677.jpg,notepad on a white background
10679.jpg,the couple sit on a lake
10680.jpg,biological species is a large house
10682.jpg,lawyer and person attend awards
10683.jpg,birds flying over the sky
10685.jpg,a hiker exploring a cliff
10686.jpg,a young woman uses a touch screen on a laptop
10687.jpg,stylish seamless pattern with cupid and different letter in a linear style .
10688.jpg,a city with one of the most futuristic buildings with large large blue sky
10689.jpg,a soldier sits on a bench outside an old gun
10690.jpg,bride and groom pose in a pretty bride .
10691.jpg,seagulls floating rhythm on the boat
10694.jpg,a young woman adds her way to watch a month sign of the book
10695.jpg,diy -- we can do the difference between the color of your own life .
10696.jpg,a group of young people doing a relaxing break on a sunny day
10698.jpg,a bus crossing arch bridge
10699.jpg,pandas which comes lives in zoo
10702.jpg,winter landscape in the mountains
10703.jpg,isometric 3d illustration of a bomb using
10704.jpg,ice pack on south shore of the beach
10706.jpg,taxi looking at a wooden table
10708.jpg,cat with a hypoallergenic coat balancing a space
10709.jpg,a raised stroke lighting in the garden
10710.jpg,a man walks on a skateboard down a street
10711.jpg,a pink tabby patch with deep
10713.jpg,vector illustration of a baseball player heading in the center .
10714.jpg,a group of young friends are walk down the boat to show music
10715.jpg,actor and person
10716.jpg,flag waving in the wind
10718.jpg,a protester speaks to fans during the community football match .
10719.jpg,ideas for a shabby office - century home
10720.jpg,young hiking in the woods
10721.jpg,a large truck delivers new wing of the sky
10722.jpg,boat stands on a white background
10725.jpg,done only leave a trip to the moon .
10726.jpg,a woman is eating a fresh fresh brace after a walk
10727.jpg,headline of the abstract red and white butterfly
10728.jpg,compost and apple on a beautiful country
10729.jpg,a worker who uses a machine on the side of the construction
10731.jpg,the palatial where the home where recently gathering and art .
10734.jpg,actor arrives for the premiere .
10737.jpg,river flowing past water on the shore of a pond
10738.jpg,a white giraffe spotted in snow
10739.jpg,priest baptising a grown man with a gift and a gift
10740.jpg,church shall was used as a nursery school
10741.jpg,retail business has collaborated 'd only
10745.jpg,a cute puppy makes a modern model by person
10746.jpg,spotted in the parking lot
10751.jpg,a pink and purple flower of water
10753.jpg,the houses where the feature plans .
10754.jpg,the detailed detailed of the cartoon style by person
10756.jpg,vector illustration of modern glossy - head on a green background
10758.jpg,a city which part of the most windows
10760.jpg,cute cartoon owl standing on a white background
10762.jpg,army soldiers of author t a large profile of large - looking up .
10763.jpg,balloons on a street with balloons over the fountain
10764.jpg,a child in a pink shirt with a smartphone
10766.jpg,actor attends the premiere of season .
10768.jpg,fruit grown radishes in a pond
10769.jpg,church shall was used as a nursery cottage
10770.jpg,homemade vegetables in a bowl - drawn ice cream
10771.jpg,actor attends the closing ceremony of festival .
10772.jpg,lizard laying on a white background
10776.jpg,the dance team performs their arm salon to benefit their music on their show
10777.jpg,a collection of old black - backed kite
10778.jpg,a city is part of the hottest destinations .
10780.jpg,holiday and all kinds ways to make this easy to the tiles .
10781.jpg,frustrated man changing wheel on a car
10783.jpg,a cute dog makes a walk along the rain
10784.jpg,young attractive woman applying her baby and smiling while holding a coffee cup
10785.jpg,add some version of choice to a manicure
10789.jpg,still life for every flower ?
10790.jpg,inspiration for the boys - camera floors
