10001.jpg,bulk of a classic milk
10003.jpg,football teams participate their win
10004.jpg,illustration of a funny bear
10009.jpg,wallpaper in the background of square tiles .
10010.jpg,the picturesque road
10011.jpg,latin pop artist performs onstage during awards
10012.jpg,hip hop artist attends the premiere
10013.jpg,vector illustration of a banner for holiday .
10014.jpg,a man stands along a bridge at the jetty
10019.jpg,a dog with a paw
10020.jpg,a special of friends eating breakfast
10022.jpg,actor arrives at the premiere
10024.jpg,add leftover cooking with a heart
10025.jpg,a dog hangs on a tree
10026.jpg,actor poses as she leaves up her debut .
10027.jpg,sugar egg on a red background
10028.jpg,a female puppy with a paw
10029.jpg,a set of chicken eggs on a plant
10030.jpg,actor arrives at the premiere
10035.jpg,a specially of astronomers observing the heavens
10039.jpg,a young couple in the grass
10040.jpg,flag waving in the wind .
10042.jpg,hard rock artist performs during the concert
10044.jpg,a young man with balloons in the park
10045.jpg,flip : the recipe was well a significant older of the pizza
10046.jpg,flag waving in the wind
10047.jpg,actor during an interview with comedian
10048.jpg,a sign warning lush vertical shot against a brightly blue sky
10049.jpg,actor and person attend the world premiere .
10050.jpg,where the famous portrait of a young woman with her cat
10052.jpg,actor with comedian at the restaurant
10053.jpg,a classic bus on the west side of a forest
10054.jpg,baseball player throws a pitch during the first inning of a baseball game against sports team .
10055.jpg,a young couple in the woods
10056.jpg,old bed in the street
10060.jpg,actor during an interview with comedian
10061.jpg,a display of bottled on a supermarket
10064.jpg,clip striped and green flowers on a wall
10066.jpg,a young couple of young people having a walk in the field
10069.jpg,a sailing and music music and music and music
10070.jpg,actor gave a little girl with a long umbrella
10071.jpg,young woman with a flags lamp pc at the beach
10072.jpg,answering questions : hundreds of the hundreds of religious leader .
10074.jpg,actor attends the los angeles premiere .
10075.jpg,a cartoon illustration of a man
10076.jpg,pretty young woman in a white dress lies on a mobile phone
10078.jpg,a view of the sky
10079.jpg,tall trees in the snow
10083.jpg,a groom in the swing of a wedding cake
10085.jpg,a model walks the runway at the show during london menswear fashion week .
10086.jpg,a wind farm pictured in the water
10087.jpg,pop artist performs live on stage during music festival
10088.jpg,person would make a lovely piece of cute purple purple and purple badge .
10091.jpg,students sitting in the classroom
10093.jpg,interior design of a small group of chairs
10096.jpg,a young lady is brushing her dogs him she has just $185 per .
10097.jpg,a logo sign outside of a front
10098.jpg,a slice of dollar bills fanned a candle
10099.jpg,person with a german rope
10103.jpg,portrait of a young woman wearing a white hat and a white dress
10104.jpg,actor attends the european premiere
10105.jpg,compare about the most kinds types of most popular face .
10106.jpg,hard rock artists perform during music festival
10109.jpg,a beautiful blue water and a pattern of water
10111.jpg,athlete was carried by automotive business during a second quarter .
10113.jpg,a set of simple lines on white background .
10115.jpg,a chef looks out of a bag
10117.jpg,the truck which has a city .
10119.jpg,vector illustration of a banner for holiday .
10120.jpg,dog labrador retriever adults in the park
10121.jpg,a man looks at the road
10122.jpg,a woman speaking in front of a building site
10123.jpg,a gate in the ready 's hand
10124.jpg,a wild wooden sign in super
10125.jpg,a view of the country
10126.jpg,hard rock artist performs on stage during a concert .
10127.jpg,cyclist and his dog rides bicycle during recurring competition .
10128.jpg,actor and tv producer attend the album release party .
10129.jpg,a poster of local people outside the grand
10130.jpg,construction worker shifts a road to the right
10131.jpg,a model walks the runway at the fashion show during event .
10132.jpg,a beautiful fawn turns a professional dog
10135.jpg,football player poses during a team photo .
10136.jpg,a female mule sits on a bench
10137.jpg,suspension bridge with cabin and accommodation area
10138.jpg,detail of a modern self by painting artist
10140.jpg,orient ball the motherboard and motherboard
10141.jpg,close up photography of a young man holding a cigarette in a bed
10142.jpg,visibility shot of a young woman holding a brown shirt
10143.jpg,a rainbow and warm sun over the sea
10144.jpg,sand construction on a construction site
10146.jpg,double air bedroom : this lilac - shirt for a simple - inclined one of a light - filled kitchen .
10147.jpg,pedestrians crossing a garage sign denouncing the street
10148.jpg,bedroom with a queen size bed
10149.jpg,dried mushrooms on a table
10150.jpg,anticipating and lots of the horse
10152.jpg,a man walks along the hole
10153.jpg,the public building has a city built in the poor
10155.jpg,a city in the capital ahead of administrative division
10161.jpg,the kitchen room with a view of bed
10163.jpg,mural in the wall
10165.jpg,vector illustration of a banner for holiday .
10167.jpg,actor and journalist attend the premiere
10173.jpg,a young man wearing a black suit speaking in a chair
10174.jpg,contemporary artist and musical artist
10175.jpg,a christmas tree from the bones
10180.jpg,equestrian model attends the world premiere
10182.jpg,a new lathe is shown filling position .
10184.jpg,coffee pouring into a glass
10185.jpg,a man in casual with baggage on the street
10187.jpg,actor attends the uk premiere
10188.jpg,basketball player and basketball player during the game .
10189.jpg,trees in the park
10190.jpg,a monitor lizard stands on a dead tree
10191.jpg,horse grazing on a horse
10193.jpg,hard rock artist performs on stage
10195.jpg,a provocative portrait of wife wearing a hat with hat
10196.jpg,interesting colours of a young male head with a metal and tattoos
10198.jpg,illustration of a girl with a map
10199.jpg,a general view of the flag colors
10200.jpg,yoga in the water
10201.jpg,a model walks the runway at the spring fashion show during event .
10204.jpg,a closer look at the tesla model spd ludicrous
10205.jpg,a tree of water 15004
10208.jpg,a group of people expressing a gift for kids
10209.jpg,funny dog with a dog in the meadow
10210.jpg,a white female puppy with a hat
10212.jpg,easter eggs in wicker basket on a white background
10213.jpg,a chain sign outside of a train
10214.jpg,actor attends the westwood premiere
10215.jpg,football player celebrates scoring the opening goal of the game against american football team .
10216.jpg,person performs onstage during the music .
10217.jpg,vector illustration of a car with car
10218.jpg,a small table on a black background
10220.jpg,a newborn 's hand giving a sick 's hand
10221.jpg,a street where the typical of village
10222.jpg,funny little girl with packages and hearts on the white background
10223.jpg,illustration of a bear bear leading in the park
10225.jpg,students listening to the radio
10226.jpg,actor and actor attend the launch event .
10227.jpg,actor attends the uk premiere
10229.jpg,portrait of a smiling young woman with a globe
10231.jpg,a model walks the runway at the fashion show during milan menswear fashion week .
10232.jpg,a model walks the beach at the entrance
10240.jpg,a dog looks curiously at a lake
10241.jpg,a man walking along the road
10242.jpg,a large tree ready out of the world
10243.jpg,biological species says carved in the early morning
10246.jpg,a surfer floating on a sandy seabed
10248.jpg,the property was built was built by a roof .
10250.jpg,a brown deer sitting on a bench and eats a picnic
10253.jpg,view from the southwest - full - height view
10254.jpg,wool coat ... a jacket from a classic belt .
10255.jpg,horizontal photo of a young woman with balloons
10260.jpg,a model walks the runway at the fashion show during fashion week .
10261.jpg,person with his team and his team .
10262.jpg,a family and friends play outdoors slow motion from a nearby
10265.jpg,a company of driftwood and a bird
10266.jpg,fresh lemons on a wooden table
10267.jpg,metal stairs on the surface
10268.jpg,unique colonial house with doors and a lion
10269.jpg,baked doughnuts with sausages on a finished plate
10270.jpg,nurse filling a tablet on a white background
10271.jpg,digital art selected for the #
10273.jpg,a dog looks at the camera
10274.jpg,actor attends the season premiere
10275.jpg,automobile model with registration cone on the track
10276.jpg,wooden planks on a downed farm after a farm
10278.jpg,a giant cylinder sits empty the house used a statue of builder
10279.jpg,person during the official game
10281.jpg,a dog looks out of a pipe
10287.jpg,sales leaves in the flower field
10288.jpg,person tries to celebrate the ball away as he continued the first half of the first quarter .
10294.jpg,portrait of a beautiful wedding couple
10295.jpg,a pair of a red cut shade
10297.jpg,a model walks the runway at the spring fashion show during event .
10298.jpg,sad woman with towel and coffee coffee on a sunny day
10301.jpg,the teams performs during the game against sports team .
10302.jpg,a ways at the entrance
10305.jpg,a cartoon illustration of a soccer drawn in the form of the empty
10308.jpg,pattern of people : the kids are tools in the sun
10309.jpg,rocky landscape with the peak
10310.jpg,squirrel carries seeds on a tree stump in the woods
10311.jpg,young female female doctor holding a bottle on a grass
10312.jpg,actor attends the press conference of the premiere .
10313.jpg,we could be seen in the world
10315.jpg,much sweater : person looked kept in the hands seat after the street wearing her hair
10317.jpg,many cookies of fruits and vegetable market in a supermarket
10318.jpg,a pretty girl stands at the temple while walking down the street
10320.jpg,the sun and the sunset
10323.jpg,a horse in the sunshine
10325.jpg,removing rust on the right side of a roof
10326.jpg,a neon facade featuring the arch ceremony
10328.jpg,vector illustration of a banner for holiday .
10331.jpg,extreme knitting : a classic kitten always add up the rest of the metal mesh .
10332.jpg,crushing cookie from the world
10334.jpg,sunflower swaying in the breeze
10335.jpg,fast rising rising in the sky
10336.jpg,actor attends the world premiere
10339.jpg,basketball center and cheer after a promotional event .
10340.jpg,bedroom with unusual blue accents and white pairing .
10345.jpg,modern bathroom with a vessel living room
10346.jpg,the slope of the abstract design
10350.jpg,a single commercial for animated object .
10351.jpg,a shadow of a green flower
10354.jpg,taxi on a rainy day
10355.jpg,the greatest skateboards of the day
10356.jpg,a lone tree in the dry forest
10358.jpg,actor is photographed by a business painting
10359.jpg,young woman wearing a black jacket wearing a black jacket and scarf
10360.jpg,kids burying on the sand
10361.jpg,wallpaper with a well dressed
10362.jpg,a romantic camp with a black silhouette of a pink flower
10363.jpg,fans will be seen in the world
10364.jpg,a boy leaps a fence with snow covered trees
10366.jpg,property image # house - 1960s #
10367.jpg,poster of a big moon
10370.jpg,actor during los angeles premiere
10371.jpg,biological species climbing in the zoo
10372.jpg,bbq on river with water floating on the river
10374.jpg,football player and battle for the ball
10376.jpg,a classic home nestled the countryside
10379.jpg,a group of people and architecture group
10381.jpg,field of wheat and food clean on the meadow
10382.jpg,deities : the painting of a girl 's rare face by person
10385.jpg,a dog looks curiously in a park
10387.jpg,tourist attraction in the mountains
10389.jpg,football player gestures during the final whistle
10391.jpg,a bee elk without a dead 's ear
10393.jpg,a model walks the runway at the spring fashion show during event .
10394.jpg,a close - up of a pink cut diamond ring with scissors
10397.jpg,family sitting on the couch bed
10400.jpg,actor attends the premiere during festival .
10401.jpg,a wall with a door
10405.jpg,a lonely iceberg on a rock
10407.jpg,actor and actor during the filming
10408.jpg,a bouquet poetry flowers with a huge of roses
10409.jpg,recurring competition in the men 's match .
10410.jpg,young woman runs along the beach
10412.jpg,the chic chic table with a long size bed .
10413.jpg,a classic home nestled the house
10414.jpg,a set of centrifugal pumps manufactured a bottle of water .
10417.jpg,a member
10418.jpg,a beautiful purple flower in the garden
10419.jpg,a model walks the runway at the fall summer fashion show during fashion week .
10423.jpg,opposing state of a beautiful floral
10426.jpg,vector illustration of a baseball ball on a white background
10427.jpg,actor spotted on the streets
10428.jpg,a windmill in the pond
10429.jpg,a man leads his horse from the leaves of a sculpture
10430.jpg,newborn baby with a lot drinks
10431.jpg,a model walks the runway at the fashion show during fashion week .
10433.jpg,vector illustration of a banner for holiday .
10434.jpg,map showing the world 's major religions >
10435.jpg,statue of author among the ancient city
10436.jpg,a city including the most expensive apartments
10438.jpg,a monkey looks at the camera
10440.jpg,a creek passing particularly desert
10442.jpg,a man walking along the precipitous of water
10443.jpg,fresh fruit isolated on a white background
10444.jpg,a flight of the head of a western flag
10445.jpg,hip hop artist performs during the photo call .
10446.jpg,channels face geisha inside the darkness
10447.jpg,politician reads a beer from his cellphone .
10449.jpg,vector illustration of a flock
10450.jpg,illustration of a flamenco dancer in a traditional floral frame by person
10451.jpg,view from the top of the river
10452.jpg,faceless man with a dog in the air
10453.jpg,actor attends the westwood premiere
10454.jpg,soaking event romantic : artist and his wife perform in concert
10456.jpg,a small aging boy running along coast
10457.jpg,cosmos flowers blooming in the wind
10458.jpg,hip hop artist performs during music festival
10459.jpg,underground hip hop artist performs live on stage during a concert .
10460.jpg,vector illustration of a banner with cross .
10461.jpg,baseball player during the match .
10463.jpg,oval of a vintage red gold and gold
10464.jpg,what type of how much the world
10466.jpg,a man throws a load of mulch
10467.jpg,a snowy green hills with clouds and its clouds
10468.jpg,profession cuts his hair with a digital camera
10469.jpg,underwater view of the sea
10471.jpg,industry : what was a floor upside out of the living room .
10473.jpg,a city at the end of the tunnel
10474.jpg,flag blowing in the wind
10475.jpg,young woman with a red bow
10478.jpg,cat with a hypoallergenic coat balancing on a white background
10479.jpg,a young woman with died 's hands
10482.jpg,bedroom bed with a sleigh bed
10483.jpg,fans will see the club ?
10485.jpg,a city with a no old map
10487.jpg,transport model parked in the borough
10488.jpg,successful business man with a tie arm
10489.jpg,a small house nestled a small house
10491.jpg,a city with a mobile home built by the sea
10492.jpg,a closeup of a metal metal chain
10496.jpg,i would love this jacket again once
10497.jpg,actor and actor at the premiere
10498.jpg,a local guard guard guard river
10499.jpg,actor attends the premiere during festival
10502.jpg,a woman riding a motorcycle in the rain
10503.jpg,a model walks the runway at the fashion show during event .
10504.jpg,pairs of the may - heel arm
10505.jpg,a mother with a red bicycle
10507.jpg,a hot air balloon rises above the clouds
10508.jpg,fireworks flashing over the sky
10511.jpg,actor attends the world premiere
10512.jpg,a flower loses a flower against a deep background
10513.jpg,three of the march - june - june .
10517.jpg,portrait of a young man
10518.jpg,a member of staff during a ceremony
10522.jpg,members of a team team at a break
10526.jpg,lazy woman with a suitcase in the park
10528.jpg,walkers enjoying along the bank
10529.jpg,people walk in the streets
10530.jpg,swimmers pose on the beach
10533.jpg,crown of thorns and shield
10534.jpg,a young woman wearing cream bow with a glass
10536.jpg,a group of students gathered to throw a crowd of baseball player during a demonstration against corruption
10537.jpg,a monkey with a globe
10538.jpg,young woman using water on a beach
10541.jpg,football player and battle for the ball
10542.jpg,young woman with a dog in the background
10543.jpg,automobile model is a common of car
10544.jpg,man with a knee injury injury in the background
10545.jpg,actor and celebrity attend awards
10546.jpg,a tree in the woods
10547.jpg,portrait of boys holding a baby
10549.jpg,a mug of coffee with seats
10552.jpg,a protester stands on the walk during clashes .
10553.jpg,vector illustration of a stamp for holiday .
10554.jpg,view of the cruise ship at night
10558.jpg,a button stone icon with a necklace
10560.jpg,a model walks the runway at the fashion show during event .
10562.jpg,football player gestures during the training session .
10564.jpg,a man stands on the beach at sunset
10565.jpg,a sustainable energy passive young men 's puppy
10569.jpg,a set of simple lines hanging on couch
10570.jpg,a single of a young woman with a hat in the rain
10571.jpg,actor and actor attend the premiere
10575.jpg,a close up of our new drawing of our living room .
10576.jpg,politician speaks during a campaign rally .
10577.jpg,ask to work a meal ?
10578.jpg,rocks and islands wilderness area
10580.jpg,silhouette of a feral jumping on a tree
10582.jpg,taipei visually reminded to get to put the streets
10586.jpg,fans will be given the banner before the opening of the new clash .
10588.jpg,illustration depicting a scene of a spooky landscape
10590.jpg,aerial view of the city
10591.jpg,a street of boarded showing a traditional ghost located
10592.jpg,a city which national crossing to the river
10593.jpg,flag blowing in the wind
10594.jpg,a little snowman at the park .
10595.jpg,a young married couple holding champagne in a glass bottle in a glass
10596.jpg,interior view of a luxury hotel
10598.jpg,time lapse of moving cloud in the sky
10599.jpg,person arrives at the premiere
10600.jpg,a motor stands along the beach
10601.jpg,fans take a rest sign to the coast
10602.jpg,the courtyard of the home
10607.jpg,a couple of young friends with a teenage girl singing singing
10608.jpg,i think like this artist
10610.jpg,activists of a puppy washing a baby
10611.jpg,a city with the bridge
10613.jpg,accommodation type of the lake
10614.jpg,the sun sets after the bus
10615.jpg,a man looks at the wall
10616.jpg,a lone tree stands on the main street of a building site
10619.jpg,disused cranes on the coast
10620.jpg,a city with a sky tower
10621.jpg,a morning generation homes last a luxury yacht
10623.jpg,a city with traditional chairs
10625.jpg,a customer views of a vintage wooden table
10626.jpg,young woman using smartphone in the park
10628.jpg,a model walks the planks of a tree
10630.jpg,actor arrives at the premiere
10631.jpg,person looks to me on the first half of the game
10633.jpg,rocks along the rocky coast
10634.jpg,fans cheer the final whistle
10635.jpg,women working working together on the ground
10639.jpg,person and traditional children 's day
10642.jpg,young woman holding a cup of coffee
10645.jpg,a woman looks at the camera
10648.jpg,a set of cricket player in the water
10649.jpg,# attempts a player against sports team .
10654.jpg,armed force gets a protester during a military exercise .
10655.jpg,bundles of straw on a white background
10656.jpg,a man walking along the beach
10657.jpg,businessman with his son in the distant seat
10658.jpg,sculpture of a young man
10659.jpg,a vector illustration of a floral sports pregnant
10660.jpg,actor spotted on stage at awards
10661.jpg,cars parked undisturbed in the city
10663.jpg,actor and person attend the premiere .
10665.jpg,musician announced a session
10667.jpg,aerial view of the forest
10668.jpg,a man wearing beanie with a hat
10671.jpg,a man 's lower engine of a car
10674.jpg,actor and actor attend the premiere .
10675.jpg,fans sing on the sideline during a game against england .
10676.jpg,hundreds of protesters enjoy a standing at the parliament 's event .
10677.jpg,a set of simple going your cash concept to get a room
10679.jpg,a group of people gather to stay a ride in the hot air balloon
10680.jpg,biological species in a field
10682.jpg,actor attending the hosted ceremony of festival
10683.jpg,wind turbine on a green meadow
10685.jpg,rock climber walks along the summit of the mountain
10686.jpg,happy family holding a cup of coffee
10687.jpg,vector seamless pattern with colorful flowers and hearts .
10688.jpg,a city with fishing boat
10689.jpg,a group of people dressed a traditional village
10690.jpg,bride and groom pose for a special wedding
10691.jpg,local water boats in the harbor
10694.jpg,a pen of a luxury hotel
10695.jpg,diy illustration of a rabbit with smiley and roses
10696.jpg,a group of people around the world 's home
10698.jpg,traffic congestion on the tarmac
10699.jpg,biological species is a food stacked on a plate
10702.jpg,a freestyle skier does a big jump to the summit in slow motion
10703.jpg,shiny ribbon or capital letter h in a 3d illustration with a soft soft soft soft soft soft surface finish surface and basic bold font isolated on a white background with clipping path .
10704.jpg,a lonely woman runs on the slopes
10706.jpg,islamic structure that will look did look like mini !
10708.jpg,cat with a hypoallergenic coat balancing out of a kitten
10709.jpg,cactus displayed on a street
10710.jpg,a man walks the road to the young house
10711.jpg,a man looks at the front of a building .
10713.jpg,male star with a suitcase in the snow
10714.jpg,spend a little boy with a gifts of gifts
10715.jpg,person and actor attend the world premiere .
10716.jpg,real flag in slow motion in slow motion
10718.jpg,fans celebrate the opening of the new headquarters .
10719.jpg,create a rental - work room design with a rental - inclined one of our home 's room .
10720.jpg,happy young man sitting on the lower of the mountains
10721.jpg,a windmill and flag flying against a clear blue sky
10722.jpg,illustration of a red and white birds
10725.jpg,a bus moves the last day of the official area .
10726.jpg,a man reading a mobile phone
10727.jpg,abstract animated abstract shapes on a transparent background
10728.jpg,compost potato with food create a fresh plant .
10729.jpg,a new online gallery showcases the launch to celebrate country .
10731.jpg,the exterior of the hotel
10734.jpg,actor arrives at the premiere
10737.jpg,still life of a fisherman taking a lake
10738.jpg,biological species perched on the ground
10739.jpg,cheerful man using a coffee at the bar
10740.jpg,a view of the cloister
10741.jpg,the model of the year
10745.jpg,biological species says a lovely older girl with giant player
10746.jpg,a man in the rain
10751.jpg,a tree in the coral
10753.jpg,palm tree in the patio
10754.jpg,illustration of a woman holding bank
10756.jpg,clock on a black background
10758.jpg,interior views of a building
10760.jpg,vector illustration of a liver with a globe
10762.jpg,army mountain in the area
10763.jpg,a model walks the runway at the show during festival .
10764.jpg,portrait of a young woman listening on a phone
10766.jpg,actor attends the premiere of comedy film
10768.jpg,a display of momo and a flower
10769.jpg,the church of houses and a church
10770.jpg,baked doughnuts with sausages on a finished
10771.jpg,comic book character in a red coat
10772.jpg,a small white pony performed tricks on a sunflower bed
10776.jpg,actor and actor attend the world premiere .
10777.jpg,a bus going through the dual carriageway .
10778.jpg,people enjoy a grill on the street
10780.jpg,all shapes shapes on a wall .
10781.jpg,a senior man leads his car in the rain
10783.jpg,underwater view of a large man with a dog
10784.jpg,young man with tablet computer in the kitchen
10785.jpg,a knife of a car
10789.jpg,still life with ingredients and blueberries
10790.jpg,inspiration for a shabby ceiling
10792.jpg,attractive young depressed man sitting together in bed and smiling at the gym
10795.jpg,fans wave autographs in the streets
10796.jpg,snowy forest with water blowing against a blue sky
10799.jpg,tattoo ideas for the design of the film
10800.jpg,a model walks the runway at the fashion show during event .
10804.jpg,digital art selected for the #
10806.jpg,a pair of a white and white border
10807.jpg,view from the southwest - full - height view
10809.jpg,actor and person attend the premiere
10812.jpg,the building was designed to apartments
10815.jpg,a 18th pond in the garden
10816.jpg,interior design of a colorful living room design
10819.jpg,a man looks on top of a branch
10821.jpg,living room with a view of bed
10823.jpg,a table of water with blur
10824.jpg,business man stands near a map in the park
10825.jpg,pouring into the great area
10826.jpg,a bus going through the dual carriageway
10827.jpg,a man driving himself with a ball standing in the forest
10829.jpg,baseball player meets a player during the game against sports team
10830.jpg,actor attending the los angeles premiere .
10831.jpg,singer and actor perform during the concert .
10833.jpg,alpine shore on the beach
10834.jpg,seamless patterned texture with a flock of dolphins birds
10838.jpg,funny dog lying on the floor
10839.jpg,bride and groom kiss in the window
10841.jpg,a general view of the earth from the night sky
10846.jpg,actors playing set in the streets
10853.jpg,actor and actor attend the world premiere .
10854.jpg,actor arrives at the premiere
10855.jpg,a man walks the field of a wall during clashes .
