10857.jpg,actor during the set of thriller film
10859.jpg,sometimes of a young boy hugging her baby girl
10864.jpg,a group of people crossing a tank
10866.jpg,featured of a rabbit
10867.jpg,a poster of a family
10868.jpg,biological species lounging on the rock
10870.jpg,actor arrives at the premiere
10872.jpg,vector illustration of a modern pixel of a building pixel
10873.jpg,football player and battle for the ball
10874.jpg,the world 's most important area where the world 's most important system to the continent
10879.jpg,middle of a picnic area
10880.jpg,happy family running on the field
10881.jpg,the project which would be found in the lobby was pedestrianised .
10886.jpg,a local watch in the picturesque harbor
10887.jpg,botanical dress with a printed skirt
10888.jpg,sand sculpture of a small stream
10889.jpg,actor attends the world premiere
10890.jpg,a stained window sits the entrance
10892.jpg,small winter and a clear - up of the world
10893.jpg,politician walks the streets at the second annual annual .
10895.jpg,a bottle of champagne with champagne
10896.jpg,looking down along the mountains
10899.jpg,underwater shot of a surfer with vast waves and sea waves
10900.jpg,portrait of a young man with beard wearing glasses and glasses unusual glasses
10901.jpg,a windmill in the wallpaper
10903.jpg,cricket player meets a coach after the game against sports team .
10904.jpg,vector illustration of a teacher with a hungry
10905.jpg,exterior of a bedroom
10908.jpg,a crew of the may now now to the water
10911.jpg,palm trees on the palm palm trees
10912.jpg,person competes during a game against country .
10914.jpg,golfer hits his team 's baseball team during the tour day of the 16th test match .
10919.jpg,military commander hold a shot as he was carried by person .
10928.jpg,guests try their freshly in the background
10931.jpg,actor attends the uk premiere
10932.jpg,actor arrives at the premiere
10935.jpg,feeding and calves resting on a green meadow
10936.jpg,a young boy carries a mobile phone in the collection
10937.jpg,actor on the red carpet
10938.jpg,a poster of military commander
10940.jpg,sculpture of a historic city
10941.jpg,hot air balloon above the sky
10942.jpg,lake with a mountain range
10943.jpg,a city with a giant security
10948.jpg,a large table runner into a seating of water .
10949.jpg,a cup of coffee with seats
10950.jpg,actor during los angeles premiere .
10953.jpg,couple family spending a picnic in the park
10954.jpg,vector illustration of a banner for holiday .
10955.jpg,a man looks at the wall of a tree
10956.jpg,a model walks the runway at the fashion show during fashion week .
10957.jpg,a model walks the runway at the fashion show during event .
10959.jpg,a poster of a gang connected fashionable
10960.jpg,actors speak onstage during awards
10964.jpg,i 'm like this type of my friend .
10966.jpg,person drives a pass during the game against university .
10970.jpg,actor and actor during an interview with actor
10971.jpg,pop artist performs during music festival
10972.jpg,a white and white image of a white and white dress
10973.jpg,a dog selling a nest in the bush
10974.jpg,vector illustration of a classic classic classic by person
10977.jpg,drink on a wooden table
10978.jpg,cricket player celebrates with his team mates after scoring the third goal of his team during the 16th round match .
10982.jpg,a young man looks at the camera
10983.jpg,actor attends the taping of comedy film .
10985.jpg,i have confused wearing a shirt online
10988.jpg,a car in the borough
10989.jpg,a small property of a young family
10991.jpg,football player celebrates scoring his sides third goal during the match .
10993.jpg,surfer and pool on the beach
10994.jpg,actor attends the gala premiere of comedy film .
10998.jpg,young woman listening suffering with a phone
11000.jpg,portrait of a young woman giving a meal
11001.jpg,horse with a platted mane
11004.jpg,actor attends the world premiere
11006.jpg,salted caramel on a table
11007.jpg,a man in a dead with a dog
11008.jpg,additional species are daily paddling nets in the canals
11013.jpg,young woman using tablet pc on the terrace
11014.jpg,a banner of a model of female hands
11015.jpg,deserted beach on the south coast
11016.jpg,a portrait of a brown and white birds
11017.jpg,football player celebrates with football player during the match .
11018.jpg,actor attends the world premiere
11021.jpg,a number of a road going to the resort
11022.jpg,a general view of the dressing vintage car during a visit .
11023.jpg,sunny day and dining area the deck
11024.jpg,a television with a red building
11025.jpg,actor attends the world premiere .
11029.jpg,a teacher and composer smoking a cigarette to his cigarette
11032.jpg,bunch rabbit in a red hat
11035.jpg,rail heads on the railway
11036.jpg,man and man standing on the beach
11040.jpg,the ruins of the ancient city
11041.jpg,a model walks the runway at the fashion show during spring .
11043.jpg,would be a beautiful country cottage
11045.jpg,a lonely banyan tree in the clouds
11053.jpg,a poster of a mother with a guide
11055.jpg,football player celebrates after scoring the opening goal during the match .
11058.jpg,animals in the grass
11060.jpg,a solitaire with a gift
11061.jpg,blank clip of a house with solar and white clouds
11062.jpg,portrait of a man with beard
11066.jpg,a family walking along a canal
11069.jpg,warm spring in the woods
11070.jpg,squirrel on a picnic table
11073.jpg,a worker enjoys a wheelchair in the wheelchair
11078.jpg,relaxed woman using a laptop in the kitchen
11079.jpg,bride and groom in the swing
11080.jpg,aerial view of the swimming pool
11081.jpg,the many faces of illustrations
11084.jpg,pregnant woman using her face in the kitchen
11087.jpg,flip with grilled sausages on a white background
11089.jpg,statue of a guard
11091.jpg,a man stands in uniform with soldiers during a protest .
11093.jpg,flag waving in the wind
11094.jpg,interior courtyard design with a small white tree
11095.jpg,stock photo : actor looks up of a smile
11097.jpg,a pair of horses panning affection from the camera
11098.jpg,a stream of water from a stream stream
11099.jpg,hip hop artist performs on stage during the concert
11103.jpg,cat with a dog in the snow
11105.jpg,food with a twist food
11106.jpg,the logo on the side of the headquarters
11107.jpg,a set of chicken with different wine
11111.jpg,a quick review of a train dining though a huge crowd of elephants
11113.jpg,people lining wreath of a palm
11114.jpg,young woman carrying a bottle on the beach
11117.jpg,a woman sitting on a map with her fingers
11118.jpg,a man riding a motorcycle past a motorist
11119.jpg,the global warming is also points the conversion of the line
11121.jpg,aerial view of roofs and water in the woods
11124.jpg,a model of the may - a model
11125.jpg,illustration of a bear bear
11126.jpg,fruit and fruits at worker market
11127.jpg,hairdresser makes a book in the woods
11129.jpg,pop artist performing on stage during the event
11130.jpg,dog dog with puppies and a dog
11131.jpg,a man walks along the road
11132.jpg,grandmother and music artist attends the christmas launch
11134.jpg,wings : the magic appeared to be having a little white blouse and matching
11136.jpg,a luxury hotel with a lot of water .
11138.jpg,actor receives a thumbs up her daughter during the community .
11139.jpg,the full - day - day 's game went the final race .
11140.jpg,tired couple sitting on the balcony of a house
11141.jpg,members of protesters flags support they run a brick wall
11142.jpg,a city is pictured in a trail
11143.jpg,we are well eye - the eye of the face ?
11145.jpg,a model walks the runway at the fashion show during fashion week .
11146.jpg,a detail of heaven from the landscape
11148.jpg,the neon sign outside the grand opening place .
11149.jpg,actor and family held the movies held
11150.jpg,actor attends the world premiere
11152.jpg,person and person having a tradition together .
11153.jpg,sunset over the beach
11154.jpg,a couple of young people walking down a river with a small dugout on a calm day
11157.jpg,a man walking on the beach
11158.jpg,a man walks along a car
11159.jpg,a classic wedding cake for different winter
11160.jpg,a greatly detailed seamless pattern with abstract mosaic and green stripes .
11162.jpg,cat sitting deeply on the floor
11164.jpg,actor attends the world premiere .
11165.jpg,birthplace on the side of a city
11166.jpg,happy baby girl with her daughter in the park
11167.jpg,polar bears in the fall
11170.jpg,person and person during a training session ahead of their game .
11171.jpg,a week generation dining table with a chess player
11175.jpg,there is a good choice of choice .
11176.jpg,a businessman unleashes a table into a coffee table
11177.jpg,group of friends and dancing at a hospital party
11179.jpg,local children relaxing their child at the beach
11180.jpg,composer and actor during the second draw .
11183.jpg,a group of students sitting together at the signing of the audience
11185.jpg,person attends the uk premiere .
11187.jpg,actor and person during the launch of romantic film
11189.jpg,fans celebrate the dismissal of the championship
11190.jpg,a tree in the woods
11191.jpg,flying over the forest
11192.jpg,a very life of a young girl wearing a green hat standing against a black wall
11193.jpg,a horse is driving a horse
11194.jpg,biological species are highly agile and a fish
11195.jpg,man running on the beach
11197.jpg,a young man with his dog amongst running next to a net of lush flowers
11198.jpg,a gate in the wild
11199.jpg,finally this recipe was a refreshing food .
11201.jpg,skyline of the most exciting buildings
11202.jpg,bougainvillea and vine in the park
11205.jpg,a group of queen and his team team attempts a technical of cricket team
11207.jpg,a model walks the runway at the fashion show during fashion week .
11209.jpg,a couch in the room
11210.jpg,a grey grey for a word for a cool grey
11212.jpg,a model walks the runway at the show during summer .
11213.jpg,abstract animation of a futuristic car
11214.jpg,actor and actor pose for a photo during the official
11215.jpg,a teal tier country of the staircase
11218.jpg,actor attends the los angeles premiere .
11220.jpg,a model of the bride with a huge candle
11221.jpg,4k portrait of family with family having fun in the park
11222.jpg,herd of horses grazing in a grassy meadow
11224.jpg,actor and celebrity attend the premiere .
11225.jpg,front view of a cafe
11226.jpg,group of people working on the street
11227.jpg,a black bear sitting on a tree trunk
11228.jpg,slow motion of seagulls running splashing on the beach
11229.jpg,plants in the center of a market
11230.jpg,a young tackle way at the power of a branch
11231.jpg,people are a local businesses supported for a new new year .
11234.jpg,a dog in the air show
11235.jpg,tips for a week - season collection of pink flowers
11236.jpg,kitten facing on the couch
11238.jpg,actor and person attend the world premiere .
11241.jpg,a little girl with a casual little girl walking on the street
11242.jpg,a piece of alternative artist visit to composer
11243.jpg,woman using a gift in the temple
11244.jpg,aerial view of the sea at sea
11245.jpg,construction site on the left of the construction
11247.jpg,horse drops the horse horse next to the wild jump
11248.jpg,guitarist and bassist perform on stage
11250.jpg,smoke over the mountains
11252.jpg,modern rendering of a modern coffee room
11253.jpg,vector illustration of a stylish guys
11255.jpg,golfer during a tour golf .
11257.jpg,a train moves the assembly line
11258.jpg,a dog looks curiously a load of water
11259.jpg,a little snake looks surprised in a bag
11262.jpg,a crew of a fishing player playing a fire in the city
11263.jpg,a collector with a lot of tools .
11264.jpg,white blank cross geometric icon .
11265.jpg,vector illustration of a set of different stationery
11266.jpg,a freestyle skier does a big jump from the summit
11267.jpg,a young boy sleeps on the bed of her baby
11269.jpg,a customer checks a car in the parking lot prior .
11270.jpg,a set of books with a dog
11273.jpg,football player celebrates scoring the opening goal during the match .
11274.jpg,a city with a sand beach
11276.jpg,a closeup of a red flower
11278.jpg,children playing in the park
11279.jpg,autumn leaves in the forest
11281.jpg,illustration of a woman with smiley and roses
11284.jpg,the public house has a bedroom
11286.jpg,a man walks along the street .
11287.jpg,zebra on a white background
11288.jpg,enjoy time lapse of seagulls sit on the beach
11289.jpg,airplane on the runway at the gardens
11290.jpg,cartoons : a painting of a spanish connected fashionable
11292.jpg,happy couple having fun on the beach
11294.jpg,close up of a young boy 's ear
11296.jpg,a worker assembles automotive industry business
11297.jpg,a wall in the underground tunnel
11298.jpg,our campsite site on the coast
11299.jpg,a collection of centrifugal pumps manufactured by person
11300.jpg,inside right now now a bold black and white colourful hot wall
11301.jpg,finished pumpkin in a heart .
11302.jpg,gothic structure is alisted of the old town
11303.jpg,give a look of our space
11304.jpg,the first high - body pattern of these autumnal
11305.jpg,an elevated train which lead to the crossing
11306.jpg,drinks on a red background
11309.jpg,the city at the high - full - height view
11310.jpg,rise light light on the night sky
11311.jpg,people enjoy a walk in the park
11312.jpg,a young man with a big dressed head in a nail
11313.jpg,actor arrives at the premiere
11314.jpg,a line of trees decorated a shop
11315.jpg,portrait of a young man with a tired dog
11319.jpg,actor arrives at the premiere
11320.jpg,baseball player during a game against sports team
11321.jpg,portrait of a young rooster
